"Tilda UID",Brand,SKU,Category,Title,Description,Text,Photo,Price,Quantity,"Price Old",Editions,Modifications,"External ID","Parent UID","SEO title","SEO descr","FB title","FB descr"
552260331851,,8500,"Навесное оборудование","Втулка гидромолота Rammer S25 (наружняя) JCB",8500,"Втулка гидромолота Rammer S25 (наружняя) JCB является необходимой деталью этой системы, которая довольно быстро изнашивается. В нашем каталоге запчастей спецтехники вы также можете приобрести другие нужные элементы – боек, уплотнения в комплекте, стяжки, пальцы, мембраны. Товары, которые есть в наличии, будут доставлены к вам на объект в ближайшее время. Они доступны для покупки оптом и в розницу, с доставкой и самовывозом. Цена на навесное оборудование погрузчика указывается на странице товара за единицу. Она зависит от вида изделия, от бренда-производителя и других особенностей.",https://static.tildacdn.com/tild3639-6164-4530-b031-656265383036/7.png,6750.0000,,,,,552260331851,,,,,
724596040672,,,"Навесное оборудование","Втулка гидромолота Rammer S25 (внутренняя) JCB",2573,"Втулка гидромолота Rammer S25 (внутренняя) JCB является частью важной системы экскаватора. Если вам требуется это или другое навесное оборудование для телескопических погрузчиков, обращайтесь к нашим специалистам.Если у вас возникли вопросы по товарам, позвоните менеджерам по указанным на сайте телефонам.",https://static.tildacdn.com/tild3033-6435-4536-b632-373966393535/8.png,6750.0000,,,,,724596040672,,,,,
819874398990,,2172,"Навесное оборудование","Палец держатель пики гидромолота Delta F5",2172,"Палец держатель пики гидромолота Delta F5, представленный в этом разделе, монтируется на рабочий инструмент. Этот товар устанавливается через отверстие в правой щеке гидромолота и закрепляется зажимом в виде трубки. Предмет подходит для гидравлического молота с механизмом DELTA FINE (South Korea),который является деталью моделей экскаваторов-погрузчиков 3СХ и 4СХ JCB. В каталоге нашего интернет-магазина вы найдете и другое навесное оборудование, доступное для заказа.",https://static.tildacdn.com/tild3565-3763-4763-a536-353261323261/9.png,1170.0000,,,,,819874398990,,,,,
698615231809,,2171,"Навесное оборудование","Палец держатель пики гидромолота JCB-260",2171,"В этом разделе представлен палец держатель пики гидромолота, предназначенный для погрузчиков моделей 3СХ и 4СХ. Такое навесное оборудование экскаватора применяется на гидравлических молотах моделей JCB 260, CAT H63 с механизмом HAMMERMASTER (Rammer). Данное приспособление просовывается в отверстие, которое имеется в правой щеке рабочего инструмента. После установки оно крепится с помощью шплинта. В нашем ассортименте вы можете приобрести и другие запчасти для спецтехники JCB. Чтобы заказать подходящий товар, зарегистрируйтесь на нашем сайте. Если у вас возникли вопросы, звоните специалистам компании.",https://static.tildacdn.com/tild6334-6636-4635-a463-363339393162/10.png,2160.0000,,,,,698615231809,,,,,
113479137497,,2284,"Навесное оборудование","Пика гидромолота Delta F10",2284,"Пика гидромолота Delta F10 обладает высоким качеством, прочностью и долговечностью. Она прослужит действительно долго, даже в случае интенсивной эксплуатации. Это навесное оборудование для полноповоротного экскаватора погрузчика изготовлено из прочных материалов и компонентов. В ассортименте вы также можете найти пику с формой рабочего инструмента «карандаш», «конус», «зубило», «крестовая», «лопатка», «тупая», «трамбовка» и многие другие. Чтобы купить пику для гидромолота, зарегистрируйтесь на нашем сайте. Менеджеры помогут вам определиться с выбором и сделать заказ.",https://static.tildacdn.com/tild3764-6230-4238-a364-336133333464/1.png,22000.0000,,,,,113479137497,,,,,
544113764775,,826/00303,"Навесное оборудование","Болт и гайка крепления зубьев",826/00303,"Болт и гайка крепления зубьев 826/00303, 1305/0714, 1340/0701 ковша и планировочноко ковша челюсти экскаваторов-погрузчиков JCB. Крепеж зубьев ковша JCB 826/00303, 1305/0714, 1340/0701 используется в качестве крепежного элемента. Она фиксирует зубья к режущему краю. Чтобы установить навесное оборудование для фронтальных погрузчиков, также требуются соответствующие шайбы и болт с головкой на шесть граней. Такая деталь используется для крепления центрального зуба к фронтальному ковшу, двух центральных и боковых к заднему. В нашем магазине вы можете приобрести эти и другие запчасти JCB, как оптом, так и в розницу. Вы также можете заказать оперативную установку купленного товара. Мастера проведут техосмотр спецтехники и монтаж детали. Болт и гайка крепления зубьев 826/00303, 1305/0714, 1340/0701 предназначены для замены вышедших из строя аналогичных изделий экскаватора-погрузчика JCB. Детали погрузчика JCB изготовлены из качественных, инновационных материалов, имеют долгий срок службы. В каталоге нашего интернет-магазина представлены детали для спецтехники JCB любой модификации. В каталоге запасных частей для экскаватора JCB представлены изделия, отвечающие всем заявленным требованиям, сопровождающиеся сертификатами соответствия и гарантийными обязательствами для вашей уверенности в высоком качестве.",https://static.tildacdn.com/tild6163-3261-4537-b135-393135346430/2.png,100.0000,,,,,544113764775,,,,,
989065534139,,332/C4388,"Навесное оборудование","Зуб JCB центральный ковша",332/C4388,"Зуб JCB центральный ковша 332/C4388, 531/03205 является надежным товаром, обеспечивающим высокую производительность работы специальной техники. Так как он относится к расходникам, которые требуют регулярной замены, он обладает впечатляющим качеством. Если вы ищете запчасти на экскаватор погрузчик JCB, выбирайте только лучшие товары. Ведь их долговечность напрямую влияет на уровень затрат на содержание спецтехники. Такое навесное оборудование для погрузчиков сделано из износостойких сталей, обладающих значительной прочностью и длительным сроком службы.",https://static.tildacdn.com/tild6333-6131-4134-b331-396433343630/3.png,950.0000,,,,,989065534139,,,,,
874101740408,,2058,"Навесное оборудование","Пика гидромолота Furukawa F6",2058,"Пика гидромолота Furukawa F6 Острие: клин",https://static.tildacdn.com/tild6539-3530-4637-a636-353733633438/4.png,8000.0000,,,,,874101740408,,,,,
442721450447,,2053,"Навесное оборудование","Пика гидромолота Caterpillar H63",2053,"Пика для гидромолота Catterpillar H63, CASE &amp; New Holland CB65, Kubota KXB 500, Case Pocline CB 370 Пика гидромолота Caterpillar H63 имеет острие карандаш. Диаметр рабочего инструмента шестьдесят три миллиметра, а его длина семьдесят сантиметров. Вес навесного оборудование для погрузчиков – четырнадцать килограмм. Его рабочий механизм: HAMMERMASTER (Rammer). Такой вариант инструмента используется тогда, когда необходимо быстро и эффективно разрушить конструкции из бетона и железобетона, демонтировать постройки. Цена пики на гидромолот указана на странице товара за единицу.",https://static.tildacdn.com/tild3231-3462-4530-b862-343465656338/5.png,6750.0000,,,,,442721450447,,,,,
310021524511,,332/A3062,"Навесное оборудование","Пика гидромолота JCB HM380",332/A3062,"Сменный инструмент гидромолота - пика JCB HM380 для оригинального навесного оборудования HammerMaster. Оригинальное название: Tool Moil Артикул: 332/A2455, 332/A2456, 332/A2457, 332/A2458, 332/A2459 332/A3061, 332/A3062, 332/A3063, 332/A3064, 332/A3065 Пика поставляется с двемя видами острия - карандаш (пирамида) и клин. Гидравлический отбойный молоток предназначен для демонтажа различных твердых поверхностей - бетона, асфальта, блочных и кирпичных перекрытий, литых панелей, каменных и шлакоблочных строений и стен. Гидромолот цепляется на заднюю стрелу экскаватора-погрузчика JCB и соединяется двумя гидравлическими шлангами к трубкам подачи рабочей гидравлической жидкости. Масло непрерывно подается в отбойный молоток через один из рукавов высокого давления и пройдя в механизме гидромолота рабочий цикл уходит через второй рукав снова в гидравлическую систему экскаватора. При подаче гидравлического масла в гидромолоте создается высокое давление, которое приводит в действие ударный механизм - баек, который с высокой силой ударяет по тыльной части сменного инструмента HM380 - пики гидромолота. Пика под действием байка совершает возвратно-поступательные движения с высокой тактовой частотой и оказывает давления на точку соприкосновения - твердую поверхность, в результате чего происходит процесс разрушения. Важно знать, что сменный инструмент предназначен прежде всего для раскалывания различных твердых поверхностей, передавая энергию удара на точку опоры, и недопустимо использование пики в качестве лома, так как пика может надломиться. Также при работе с навесным оборудованием необходимо соблюдать меры предосторожности, так от разрушающейся поверхности отлетают в разные стороны куски. Пика гидромолота HammerMaster JCB НМ380 должна беспрепятственно двигаться во внешней и внутренней втулках гидромолота, не встречая сопротивления и трения, поэтому необходимо своевременно проводить шприцевание инструмента. Наилучшей смазкой для ударных механизмов оригинального навесного оборудования HammerMaster являются консистентные графитовые смазки с высокотемпературным режимом, которые не плавятся и не текут из гидромолота при высоких ударных нагрузках.",https://static.tildacdn.com/tild6530-6534-4531-b932-366362326534/6.png,8500.0000,,,,,310021524511,,,,,
320249494343,,2052,"Навесное оборудование","Пика гидромолота JCB HM 260",2052,"В этом разделе каталога вы можете купить пику для гидромолота экскаватора-погрузчика. Ее рабочий механизм – HAMMERMASTER (Rammer). Форма пики гидромолота JCB HM 260 называется «карандаш». Эта особенность определяет сферу применения товара. Такое оборудование используется тогда, когда необходимо с применением значительной мощности разрушить хрупкие строительные материалы. Обычно с его помощью ломают крупные конструкции из бетона и железобетона. В нашем интернет-магазине вы можете приобрести запчасти JCB оптом и в розницу, с оперативной доставкой и даже с установкой на спецтехнику. Пика-конус: используется для вскрытия бетонных покрытий, дробления негабаритов, а также для общих разрушающих работ, где требуется проникающее разрушение. Пика-зубило: подходит для разрушения асфальта, мерзлого грунта и там, где необходимо срезающее действие, т.е, рубка или ступенчатая выработка. Зубило имеет большую степень износа и больший уровень напряжения в области фиксации пики. Пика-карандаш: применяется для разрушения бетона, железобетона, осуществления демонтажных работ, т.е., в случаях, когда требуется повышенная разрушительная сила. Как правило, такая пика предназначена для работы с достаточно хрупкими материалами. Пика-зубило с канавками: используется для работы с материалами, способными при разрушении разбиваться на мелкие части, которые гасят часть энергии удара гидромолота. Пика-крестовая: применяется в условиях образования большого количества мелких частей обрабатываемого материала, частично гасящих энергию удара гидромолота. Пика-лопатка: представляет собой широкое зубило для повышенной эффективности в мягком материале (например, для вскрытия асфальтового покрытия). Пика-тупая: используется для дробления больших объектов на мелкие части, дробления высокопрочных горных пород, гранита, для работ в рудных и нерудных карьерах. Такая пика используется, по-преимуществу, для вторичного разрушения материалов, для дробления негабаритов прочных пород (например, после буровзрывных работ); пика легко устанавливается на обрабатываемый объект и не соскальзывает. Пика-тупая с увеличенным диаметром: применяется для вторичного разрушения материалов, отличается большой износоустойчивостью и увеличенным сроком службы. Пика-трамбовка: используется для уплотнения рыхлых грунтов.",https://static.tildacdn.com/tild3237-6434-4833-b062-393536656566/7.png,7500.0000,,,,,320249494343,,,,,
220148376871,,2056,"Навесное оборудование","Пика гидромолота Delta F6",2056,"Представляем вам разнообразные запчасти для экскаватора JCB. В этом разделе вы можете приобрести пику гидромолота Delta F6. Ее острие карандаш используется тогда, когда необходимо разрушить хрупкий материал, применяя значительную силу. Такой товар легко сломает даже большие конструкции из бетона и железобетона. Его диаметр семьдесят пять миллиметров, а длина семьдесят сантиметров. Цена пики на гидромолот указана на странице товара за единицу. Чтобы заказать ее, вам необходимо зарегистрироваться на сайте и добавить предмет в Корзину. Если у вас возникли вопросы, звоните нашим менеджерам. Пика-конус: используется для вскрытия бетонных покрытий, дробления негабаритов, а также для общих разрушающих работ, где требуется проникающее разрушение. Пика-зубило: подходит для разрушения асфальта, мерзлого грунта и там, где необходимо срезающее действие, т.е, рубка или ступенчатая выработка. Зубило имеет большую степень износа и больший уровень напряжения в области фиксации пики. Пика-карандаш: применяется для разрушения бетона, железобетона, осуществления демонтажных работ, т.е., в случаях, когда требуется повышенная разрушительная сила. Как правило, такая пика предназначена для работы с достаточно хрупкими материалами. Пика-зубило с канавками: используется для работы с материалами, способными при разрушении разбиваться на мелкие части, которые гасят часть энергии удара гидромолота. Пика-крестовая: применяется в условиях образования большого количества мелких частей обрабатываемого материала, частично гасящих энергию удара гидромолота. Пика-лопатка: представляет собой широкое зубило для повышенной эффективности в мягком материале (например, для вскрытия асфальтового покрытия). Пика-тупая: используется для дробления больших объектов на мелкие части, дробления высокопрочных горных пород, гранита, для работ в рудных и нерудных карьерах. Такая пика используется, по-преимуществу, для вторичного разрушения материалов, для дробления негабаритов прочных пород (например, после буровзрывных работ); пика легко устанавливается на обрабатываемый объект и не соскальзывает. Пика-тупая с увеличенным диаметром: применяется для вторичного разрушения материалов, отличается большой износоустойчивостью и увеличенным сроком службы. Пика-трамбовка: используется для уплотнения рыхлых грунтов.",https://static.tildacdn.com/tild6430-6235-4166-b338-656530353533/89.png,8000.0000,,,,,220148376871,,,,,
