"Tilda UID",Brand,SKU,Category,Title,Description,Text,Photo,Price,Quantity,"Price Old",Editions,Modifications,"External ID","Parent UID","SEO title","SEO descr","FB title","FB descr"
637339504924,,450/10226,"Тормозная система","Диск тормозной JCB",450/10226,"Наш интернет-магазин предлагает тормозные диски модели 450/10226 по демократичной цене. Эти запчасти оригинальные, выполнены из высококачественных материалов, подходят для экскаваторов-погрузчиков JCB. При правильной установке работают эффективно, с ними тормозная система будет в полном порядке. Чтобы заказать эту и другие детали для спецтехники, просто добавьте товар в корзину. Также возможен оперативный монтаж на вашу модель. Для получения подробной консультации позвоните по телефону, который дан на сайте, или сформируйте заявку на обратный звонок.",https://static.tildacdn.com/tild3166-3736-4262-b130-626136646630/1.png,790.0000,,,,,637339504924,,,,,
861425670698,,126/00200,"Тормозная система","Бачок тормозной жидкости JCB",126/00200,"Данный бачок для залива тормозной гидравлической жидкости устанавливался на экскаваторы-погрузчики JCB 3CX, JCB 4CX с тормозной системой, при которой усилие передается от педали тормоза на главные тормозные цилиндры посредством создания необходимого давления вакуумными усилителями тормоза и подачей гидравлической жидкости в каналы тормозного суппорта заднего моста.",https://static.tildacdn.com/tild3437-3764-4039-b165-326361653564/2.png,990.0000,,,,,861425670698,,,,,
860329223348,,15/920160,"Тормозная система","Тормозные колодки ручного тормоза JCB",15/920160,"Комплект тормозных колодок стояночного тормоза прямоугольные JCB 15/920160, 452/02700 старого образца для экскаваторов-погрузчиков JCB до 2002 года выпуска.",https://static.tildacdn.com/tild6134-3933-4761-b538-383632626130/3.png,1190.0000,,,,,860329223348,,,,,
890415796991,,15/920103,"Тормозная система","Тормозные колодки ручного тормоза круглые JCB",15/920103,"Комплект тормозных колодок стояночного тормоза круглые JCB 15/920103 нового образца для экскаваторов-погрузчиков JCB после 2000 года выпуска. Оригинальное название: Kit-pad brake pad",https://static.tildacdn.com/tild6136-6232-4162-b337-616161303634/4.png,1390.0000,,,,,890415796991,,,,,
596522231869,,15/905501,"Тормозная система","Вакуумный усилитель тормозов JCB",15/905501,"Вакуумный усилитель тормозов JCB <br />",https://static.tildacdn.com/tild3735-3631-4436-a237-383664303162/5.png,7590.0000,,,,,596522231869,,,,,
116307050090,,15/920110,"Тормозная система","Тормозной цилиндр JCB Perkins",15/920110,"Цилиндр Perkins 15/920110 - важный элемент тормозной системы. Применяется для старых моделей JCB, таких как 3CХ и 4СХ, где представлены автоматически регулируемые дисковые тормоза. Чтобы работа системы была бесперебойной, важно следить за тем, чтобы все детали были исправными. Качество этого цилиндра проверено при работе спецтехники даже в сложных погодных условиях, он изготовлен из добротных материалов. Его несложно установить и отрегулировать.",https://static.tildacdn.com/tild3465-6665-4833-a330-386638346363/6.png,4590.0000,,,,,116307050090,,,,,
463490914877,,15/920389,"Тормозная система","Главный тормозной цилиндр",15/920389,"Главный тормозной цилиндр 15/920389, 15/905504, 15/920158 является центральным элементом данной системы. Такая запчасть устанавливается на экскаватор-погрузчик с двумя основными целями. Во-первых, она препятствует произвольному движению транспорта в нерабочее время. Во-вторых, она позволяет замедлять скорость спецтехники и полностью останавливать ее. Элемент воздействует на тормозные колодки дискового типа.",https://static.tildacdn.com/tild6361-3561-4262-a366-373832393332/7.png,2790.0000,,,,,463490914877,,"Главный тормозной цилиндр","Главный тормозной цилиндр 15/920389, 15/905504, 15/920158 является центральным элементом данной системы. Такая запчасть устанавливается на экскаватор-погрузчик с двумя основными целями. Во-первых, она препятствует произвольному движению транспорта в нерабочее время. Во-вторых, она позволяет замедлять скорость спецтехники и полностью останавливать ее. Элемент воздействует на тормозные колодки дискового типа.",,
641312928134,,450/10226,"Тормозная система","Диск тормозной JCB",450/10226,"Наш интернет-магазин предлагает тормозные диски модели 450/10226 по демократичной цене. Эти запчасти оригинальные, выполнены из высококачественных материалов, подходят для экскаваторов-погрузчиков JCB. При правильной установке работают эффективно, с ними тормозная система будет в полном порядке. Чтобы заказать эту и другие детали для спецтехники, просто добавьте товар в корзину.",https://static.tildacdn.com/tild3832-6437-4437-b131-633663396532/8.png,790.0000,,,,,641312928134,,,,,
139588357802,,450/10224,"Тормозная система","Диск фрикционный заднего моста",450/10224,"Тормозной диск фрикционный с феррадо заднего моста JCB 450/10224",https://static.tildacdn.com/tild3864-3733-4535-b233-363332353931/9.png,790.0000,,,,,139588357802,,,,,
522842747747,,332/H3679,"Тормозная система","Энергоаккумулятор тормозной JCB",332/H3679,"Энергоаккумулятор тормозной заряженый 332/H3679 для JCB 3CX/4CX Производство: FRANCE. <br /> Расположение: справа по ходу движения под капотом возле турбины экскаватора-погрузчика JCB 3CX/4CX. <br /><br />",https://static.tildacdn.com/tild6637-3935-4461-b134-646664613362/10.png,12990.0000,,,,,522842747747,,,,,
863997086908,,332/G7186,"Тормозная система","Гидроаккумулятор тормозной системы JCB",332/G7186,"Гидроаккумулятор тормозной системы JCB 332/G7186 заряженный азотом для экскаватора-погрузчика JCB. Оригинальное название: Accumulator",https://static.tildacdn.com/tild3038-3233-4733-a132-376636383937/1.png,13900.0000,,,,,863997086908,,,,,
127930973177,,450/24303,"Тормозная система","Направляющий палец тормозного поршня JCB",450/24303,"Оригинальное название: Pin headed backoff. <br /><br /> Направляющий палец тормозного поршня (оригинальное название - pin-headed backoff) - важный элемент тормозной системы заднего моста JCB. Удерживает суппорт на поворотном кулаке. Подходит для моделей погрузчиков 3СХ и 4СХ. <br /><br />",https://static.tildacdn.com/tild6239-6138-4262-a263-366165333939/2.png,990.0000,,,,,127930973177,,,,,
882095518803,,910/60203,"Тормозная система","Трос стояночного ручного тормоза JCB",910/60203,"Трос стояночного ручного тормоза JCB 910/60203, 910/M1244 для экскаваторов-погрузчиков JCB 3CX, 4CX Оригинальное название: Cable parkbrake Описание: трос ручника 910/60203, 910/M1244 отвечает за блокировку тормозов во время остановки и стоянки техники, приводится в действие оператором из кабины поднятием стояночного рычага, который натягивая стояночный трос приводит к зажиму тормозных колодок. Трос стояночного ручного тормоза JCB 910/60203, 910/M1244 выполнен из высокопрочных материалов с применением передовых технологий, износоустойчив, необходим для замены аналогичной детали погрузчика. В нашем магазине представлены качественные запчасти от проверенных производителей, заказать и приобрести которые можно с доставкой во все регионы России. Мы предоставляем каталог запасных частей погрузчика и реализуем детали, изготовленные в соответствии с мировыми стандартами соответствия качества, безопасности и гарантийным сроком эксплуатации. Все изделия продаются по самым оптимальным ценам.",https://static.tildacdn.com/tild3165-6464-4963-b530-613264376364/3.png,2290.0000,,,,,882095518803,,,,,
233138111982,,458/20693,"Тормозная система","Диск стояночного тормоза JCB",458/20693,"Диск стояночного тормоза JCB 458/20693 устанавливается на заднем мосту со стороны коробки переключения передач. Он представляет собой плоскую шайбу из металла с отверстием посередине. Деталь погрузчика используется как основной механизм в тормозной системе трансмиссионного тормоза. Главная особенность такой конструкции – воздействие на трансмиссию, а не на колеса. Она используется в большинстве случаев, в отличие вариантов с электронным приводом или барабанных. Интересуют эти и другие запчасти JCB? Регистрируйтесь на сайте и добавляйте их в Корзину! Менеджеры проконсультируют вас по всем вопросам.",https://static.tildacdn.com/tild6539-3131-4265-b361-326437306432/4.png,12590.0000,,,,,233138111982,,,,,
668302502127,,265/00989,"Тормозная система","Крышка бачка тормозной жидкости JCB",265/00989,"Крышка тормозного бачка 265/00989 для JCB 3CX, JCB 4CX",https://static.tildacdn.com/tild3862-6235-4031-b536-363535633238/5.png,390.0000,,,,,668302502127,,,,,
789507364398,,813/50012-26,"Тормозная система","Уплотнение тормозного суппорта JCB",813/50012-26,"Уплотнение тормозного суппорта JCB 813/50012-26 используется для герметизации элементов и гидроизоляции. Специальное изделие особой конструктивной формы играет немаловажную роль. Прежде всего, такие запасные части JCB защищают изделия от попадания влаги, грязи, воздуха, посторонних предметов. Также они оберегают тормозной суппорт от преждевременного или быстрого износа. Вы можете купить запчасти на экскаватор-погрузчик онлайн, заказав их с оперативной доставкой или самовывозом из магазинов компании. Менеджеры помогут вам сделать заказ, проконсультируют по ассортименту.",https://static.tildacdn.com/tild3163-3165-4637-a262-653161633930/6.png,2390.0000,,,,,789507364398,,,,,
623608438423,,813/50012,"Тормозная система","Уплотнение тормозного поршня (малое) JCB",813/50012,"Уплотнение тормозного поршня малое JCB 813/50012, представленное в этом разделе, доступно для заказа онлайн из каталога запасных частей погрузчика. Данный товар создается из прочного, долговечного материала, который оберегает детали от преждевременного износа. Также он препятствует попаданию в тормозной поршень влаги, грязи и пыли, обеспечивает герметичность и влагостойкость. Хотите заказать запчасти для JCB 3CX в Москве? Зарегистрируйтесь на сайте компании и добавьте товар в Корзину. В случае возникновения вопросов по ассортименту, звоните менеджерам или заказывайте обратный звонок.",https://static.tildacdn.com/tild3139-3035-4962-a566-336439316135/7.png,590.0000,,,,,623608438423,,,,,
639262860462,,813/50026,"Тормозная система","Уплотнение тормозного поршня (большое) JCB",813/50026,"Предлагаем вам приобрести уплотнение тормозного поршня большое JCB 813/50026. Это специальный элемент, созданный из прочного, долговечного и стойкого к износу материала. Изделие используется для герметизации тормозного поршня. Оно защищает элемент от влаги, грязи и пыли, а также от преждевременного износа. Запчасть для спецтехники представлена в интернет-магазине по доступной цене. Стоимость указана на странице товара. Чтобы приобрести товары из каталога запчастей JCB онлайн, пройдите регистрацию на сайте.",https://static.tildacdn.com/tild6539-6561-4839-b937-653739626462/8.png,690.0000,,,,,639262860462,,,,,
823481188163,,649/31004,"Тормозная система","Тормозной шланг 900мм JCB",649/31004,"В магазине JCB вы найдете качественные запчасти от ведущих производителей со всего мира. Если вам нужна консультация специалиста, звоните или заказывайте обратный звонок. Менеджеры помогут вам сделать выбор и заказ. В этом разделе вы найдете тормозной шланг 900 мм JCB 649/31004. Это отрезок из политетрафторэтилена и стальной оплетки. В некоторых случаях он дополняется пластиковой защитной трубкой. Такие детали для спецтехники обеспечивают тормозной системе полную герметичность, они не пропускают влагу и воздух. Также они защищают ее от преждевременного износа, обеспечивая надежность и долговечность.",https://static.tildacdn.com/tild3535-6534-4537-b961-383865346433/9.png,2290.0000,,,,,823481188163,,,,,
731612307573,,910/60207,"Тормозная система","Трос ручного тормоза JCB",910/60207,"В каталоге запчастей спецтехники вы найдете множество качественных товаров от ведущих производителей. На этой странице есть тросик ручного тормоза (н.м.) JCB 910/60207, который является важным элементом специальной техники и представлен в новой модели. Он устанавливается под капотом (возможен самостоятельный монтаж) и выполняет основную роль в процессе торможения. Если эта деталь неисправна, эксплуатация транспортного средства полностью запрещена. Чтобы купить запчасти JCB в Москве, сделайте заказ онлайн. Изделия доступны для приобретения оптом и в розницу, с доставкой и самовывозом.",https://static.tildacdn.com/tild3438-3262-4264-a462-613837333130/10.png,3190.0000,,,,,731612307573,,,,,
697050845482,,649/51320,"Тормозная система","Тормозной шланг 760мм правый JCB",649/51320,"Хотите купить запчасти JCB по приемлемым ценам? Загляните в магазин нашей компании! Выбирайте продукцию, заказывайте ее онлайн с доставкой или забирайте самовывозом из магазинов в столице! В этом разделе представлен тормозной шланг 760 мм правый JCB 649/51320. Он изготавливается из политетрафторэтилена и стальной оплетки, иногда дополняется пластиковой защитной трубкой. Предмет имеет несколько функций – обеспечение долговечности, надежности и герметичности системы, защита от влаги и воздуха. Запчасти для экскаваторов можно заказать с доставкой по Москве и в другие города страны.",https://static.tildacdn.com/tild3964-3738-4539-a264-623536336331/1.png,2290.0000,,,,,697050845482,,,,,
705168740556,,649/51240,"Тормозная система","Тормозной шланг 580мм левый JCB",649/51240,"Ищете качественные детали для погрузчиков от английского бренда? Загляните в каталоги запчастей спецтехники и закажите выбранные товары онлайн! У вас есть вопросы? Звоните или заказывайте обратный звонок. В этом разделе представлен тормозной шланг 580 мм левый JCB 649/51240. Он обладает значительной долговечностью, высокой прочностью и стойкостью к износу. Изделие не боится воздействия агрессивных сред и механических повреждений, не трескается и не высыхает. Такие запчасти JCB оберегают систему от преждевременного износа, случайного проникновения влаги и воздуха извне.",https://static.tildacdn.com/tild3833-6162-4339-b866-323263336635/2.png,2290.0000,,,,,705168740556,,,,,
856189937886,,998/10456,"Тормозная система","Тормозной цилиндр рабочий в сборе с поршнем JCB",998/10456,"Представляем вам широкий каталог запчастей для экскаватора JCB. В продаже представлены оригинальные и неоригинальные товары от ведущих производителей. Продукцию можно приобрести онлайн, как оптом, так и в розницу, с оперативной доставкой или самовывозом из магазинов в столице. В этом разделе для заказа доступен тормозной цилиндр рабочий в сборе с поршнем JCB 998/10456. Он используется для снижения скорости и остановки специальной техники, для препятствия самопроизвольного движения в нерабочее время. Такая деталь погрузчика являет собой центральный элемент тормозной системы.",https://static.tildacdn.com/tild3631-6436-4030-a663-633939653132/3.png,12590.0000,,,,,856189937886,,,,,
122145491080,,458/20353,"Тормозная система","Диск фрикционный заднего моста JCB",458/20353,"В этом разделе представлен тормозной диск фрикционный с феррадо заднего моста JCB 458/20353. Данный элемент являет собой изделие из прочного, долговечного и износостойкого металла. Такие детали служат для обеспечения торможения спецтехники. Они устанавливаются на заднем мосту между главной парой и бортовым редуктором. Предметы должны быть качественными и надежными, ведь от таких элементов зависит безопасность. Запчасти на экскаватор-погрузчик JCB доступны для заказа онлайн. Чтобы сделать заказ, регистрируйтесь на сайте и добавьте товар в Корзину. Менеджеры проконсультируют вас по всем вопросам.",https://static.tildacdn.com/tild3662-6263-4736-b637-626530313334/4.png,690.0000,,,,,122145491080,,,,,
